{
  "$schema": "../../schema/breeds.schema.json",
  "schemaVersion": 1,
  "species": "cat",
  "sources": [
    {
      "name": "Cat Fanciers' Association breeds",
      "url": "https://cfa.org/breeds/",
      "retrievedAt": "2026-10-13"
    },
    {
      "name": "The International Cat Association breeds",
      "url": "https://tica.org/ticas-breeds/browse-all-breeds/",
      "retrievedAt": "2026-10-13"
    },
    {
      "name": "Federation Internationale Feline breeds",
      "url": "https://fifeweb.org/cats/breeds/",
      "retrievedAt": "2026-10-13"
    },
    {
      "name": "Governing Council of the Cat Fancy GEMS codes",
      "url": "https://www.gccfcats.org/breeding-cats/new-to-breeding/registration-policies/gems-codes/",
      "retrievedAt": "2026-10-13",
      "note": "GCCF GEMS codes mapped to the six official show sections; coat-length codes can resolve to one canonical breed."
    }
  ],
  "breeds": [
    {
      "id": "cat:abyssinian",
      "name": "Abyssinian",
      "slug": "abyssinian",
      "facts": {
        "registryRecognition": [
          {
            "registry": "cfa",
            "registryId": "Abyssinian",
            "name": "Abyssinian",
            "status": "recognized",
            "auditedAt": "2026-10-13"
          },
          {
            "registry": "fife",
            "registryId": "ABY",
            "name": "Abyssinian",
            "status": "recognized",
            "auditedAt": "2026-10-13"
          },
          {
            "registry": "gccf",
            "registryId": "ABY",
            "name": "Abyssinian",
            "status": "recognized",
            "auditedAt": "2026-10-13"
          },
          {
            "registry": "tica",
            "registryId": "Abyssinian",
            "name": "Abyssinian",
            "status": "recognized",
            "auditedAt": "2026-10-13"
          }
        ]
      }
    },
    {
      "id": "cat:american-bobtail",
      "name": "American Bobtail",
      "slug": "american-bobtail",
      "aliases": [
        "American Bobtail Shorthair"
      ],
      "facts": {
        "registryRecognition": [
          {
            "registry": "cfa",
            "registryId": "American Bobtail",
            "name": "American Bobtail",
            "status": "recognized",
            "auditedAt": "2026-10-13"
          },
          {
            "registry": "tica",
            "registryId": "American Bobtail",
            "name": "American Bobtail",
            "status": "recognized",
            "auditedAt": "2026-10-13"
          },
          {
            "registry": "tica",
            "registryId": "American Bobtail Shorthair",
            "name": "American Bobtail Shorthair",
            "status": "recognized",
            "auditedAt": "2026-10-13"
          }
        ]
      }
    },
    {
      "id": "cat:american-curl",
      "name": "American Curl",
      "slug": "american-curl",
      "aliases": [
        "American Curl Longhair",
        "American Curl Shorthair"
      ],
      "facts": {
        "registryRecognition": [
          {
            "registry": "cfa",
            "registryId": "American Curl",
            "name": "American Curl",
            "status": "recognized",
            "auditedAt": "2026-10-13"
          },
          {
            "registry": "fife",
            "registryId": "ACL",
            "name": "American Curl Longhair",
            "status": "recognized",
            "auditedAt": "2026-10-13"
          },
          {
            "registry": "fife",
            "registryId": "ACS",
            "name": "American Curl Shorthair",
            "status": "recognized",
            "auditedAt": "2026-10-13"
          },
          {
            "registry": "tica",
            "registryId": "American Curl",
            "name": "American Curl",
            "status": "recognized",
            "auditedAt": "2026-10-13"
          },
          {
            "registry": "tica",
            "registryId": "American Curl Longhair",
            "name": "American Curl Longhair",
            "status": "recognized",
            "auditedAt": "2026-10-13"
          }
        ]
      }
    },
    {
      "id": "cat:american-shorthair",
      "name": "American Shorthair",
      "slug": "american-shorthair",
      "facts": {
        "registryRecognition": [
          {
            "registry": "cfa",
            "registryId": "American Shorthair",
            "name": "American Shorthair",
            "status": "recognized",
            "auditedAt": "2026-10-13"
          },
          {
            "registry": "tica",
            "registryId": "American Shorthair",
            "name": "American Shorthair",
            "status": "recognized",
            "auditedAt": "2026-10-13"
          }
        ]
      }
    },
    {
      "id": "cat:american-wirehair",
      "name": "American Wirehair",
      "slug": "american-wirehair",
      "facts": {
        "registryRecognition": [
          {
            "registry": "cfa",
            "registryId": "American Wirehair",
            "name": "American Wirehair",
            "status": "recognized",
            "auditedAt": "2026-10-13"
          },
          {
            "registry": "tica",
            "registryId": "American Wirehair",
            "name": "American Wirehair",
            "status": "recognized",
            "auditedAt": "2026-10-13"
          }
        ]
      }
    },
    {
      "id": "cat:asian",
      "name": "Asian",
      "slug": "asian",
      "aliases": [
        "Asian Longhair",
        "Asian Shorthair"
      ],
      "facts": {
        "registryRecognition": [
          {
            "registry": "gccf",
            "registryId": "ALH",
            "name": "Asian Longhair",
            "status": "recognized",
            "auditedAt": "2026-10-13"
          },
          {
            "registry": "gccf",
            "registryId": "ASH",
            "name": "Asian Shorthair",
            "status": "recognized",
            "auditedAt": "2026-10-13"
          }
        ]
      }
    },
    {
      "id": "cat:australian-mist",
      "name": "Australian Mist",
      "slug": "australian-mist",
      "facts": {
        "registryRecognition": [
          {
            "registry": "gccf",
            "registryId": "AUM",
            "name": "Australian Mist",
            "status": "recognized",
            "auditedAt": "2026-10-13"
          },
          {
            "registry": "tica",
            "registryId": "Australian Mist",
            "name": "Australian Mist",
            "status": "recognized",
            "auditedAt": "2026-10-13"
          }
        ]
      }
    },
    {
      "id": "cat:balinese",
      "name": "Balinese",
      "slug": "balinese",
      "facts": {
        "registryRecognition": [
          {
            "registry": "cfa",
            "registryId": "Balinese",
            "name": "Balinese",
            "status": "recognized",
            "auditedAt": "2026-10-13"
          },
          {
            "registry": "fife",
            "registryId": "BAL",
            "name": "Balinese",
            "status": "recognized",
            "auditedAt": "2026-10-13"
          },
          {
            "registry": "gccf",
            "registryId": "BAL",
            "name": "Balinese",
            "status": "recognized",
            "auditedAt": "2026-10-13"
          },
          {
            "registry": "tica",
            "registryId": "Balinese",
            "name": "Balinese",
            "status": "recognized",
            "auditedAt": "2026-10-13"
          }
        ]
      }
    },
    {
      "id": "cat:bengal",
      "name": "Bengal",
      "slug": "bengal",
      "aliases": [
        "Bengal Longhair"
      ],
      "facts": {
        "registryRecognition": [
          {
            "registry": "cfa",
            "registryId": "Bengal",
            "name": "Bengal",
            "status": "recognized",
            "auditedAt": "2026-10-13"
          },
          {
            "registry": "fife",
            "registryId": "BEN",
            "name": "Bengal",
            "status": "recognized",
            "auditedAt": "2026-10-13"
          },
          {
            "registry": "gccf",
            "registryId": "BEN",
            "name": "Bengal",
            "status": "recognized",
            "auditedAt": "2026-10-13"
          },
          {
            "registry": "tica",
            "registryId": "Bengal",
            "name": "Bengal",
            "status": "recognized",
            "auditedAt": "2026-10-13"
          },
          {
            "registry": "tica",
            "registryId": "Bengal Longhair",
            "name": "Bengal Longhair",
            "status": "recognized",
            "auditedAt": "2026-10-13"
          }
        ]
      }
    },
    {
      "id": "cat:birman",
      "name": "Birman",
      "slug": "birman",
      "aliases": [
        "Sacred Birman"
      ],
      "facts": {
        "registryRecognition": [
          {
            "registry": "cfa",
            "registryId": "Birman",
            "name": "Birman",
            "status": "recognized",
            "auditedAt": "2026-10-13"
          },
          {
            "registry": "fife",
            "registryId": "SBI",
            "name": "Sacred Birman",
            "status": "recognized",
            "auditedAt": "2026-10-13"
          },
          {
            "registry": "gccf",
            "registryId": "SBI",
            "name": "Birman",
            "status": "recognized",
            "auditedAt": "2026-10-13"
          },
          {
            "registry": "tica",
            "registryId": "Birman",
            "name": "Birman",
            "status": "recognized",
            "auditedAt": "2026-10-13"
          }
        ]
      }
    },
    {
      "id": "cat:bombay",
      "name": "Bombay",
      "slug": "bombay",
      "facts": {
        "registryRecognition": [
          {
            "registry": "cfa",